{
  "schema_version": "1.0",
  "event_id": "bc9ff524-0457-514d-bc98-7f2d1f7c5280",
  "event_type": "interview.resume-analysis.outcome",
  "occurred_at": "2026-07-23T08:00:05Z",
  "tenant_id": "aaaaaaaa-aaaa-4aaa-8aaa-aaaaaaaaaaaa",
  "aggregate_id": "11111111-1111-4111-8111-111111111111",
  "analysis_id": "11111111-1111-4111-8111-111111111111",
  "application_id": "33333333-3333-4333-8333-333333333333",
  "status": "COMPLETED",
  "summary": "Backend engineer with Java and distributed systems experience.",
  "skills": ["Java", "Spring Boot", "RabbitMQ"],
  "evidence": [{"excerpt": "Built event-driven services", "source_location": "page 1"}],
  "error_code": null
}
